{
  "acp_version": "0.2.1-draft",
  "execution_id": "exec-20260725-ollama-prompt-a1b2c3d4",
  "action": "ollama.prompt",
  "version": "1.2.0",
  "provenance": {
    "principal": "slarti",
    "session_id": "session-gh-88",
    "trace_id": "trace-a1b2c3d4e5f6",
    "created_at": "2026-07-25T12:00:00Z"
  },
  "parameters": {
    "model": "qwen3.5:4b",
    "prompt": "Explain the ACP Execution Contract in one sentence.",
    "stream": false
  },
  "preconditions": [
    {
      "type": "tool_available",
      "target": "ollama.prompt:1.2.0",
      "message": "Ollama prompt action must be registered"
    },
    {
      "type": "network_reachable",
      "target": "192.168.2.211:11434",
      "message": "Ollama host must be reachable"
    },
    {
      "type": "resource_free",
      "target": "gpu",
      "message": "GPU must not be locked by another process"
    }
  ],
  "security": {
    "allowed_hosts": ["192.168.2.211:11434"],
    "requires_approval": false
  },
  "constraints": {
    "timeout_seconds": 120,
    "max_retries": 2,
    "concurrency_key": "gpu",
    "idempotency_key": "exec-20260725-ollama-prompt-a1b2c3d4"
  },
  "rollback": {
    "strategy": "none",
    "action": "",
    "parameters": {}
  },
  "success_criteria": [
    {
      "type": "exit_code",
      "target": "0"
    },
    {
      "type": "output_match",
      "target": ".*success.*"
    }
  ],
  "evidence": {
    "require_output": true,
    "require_artifacts": false,
    "require_logs": true
  },
  "failure_handling": {
    "error_classes": ["timeout", "execution", "permission"],
    "notify_on": ["failure"],
    "escalate_after": 3
  }
}
